{"backends":{"blobMode":"offline-only","da":"local-mock-or-offline-only","tee":"simulated-only"},"build":{"artifactRoot":"artifacts","cacheRoot":"cache","configPath":"evm/revision/hardhat.config.js","evmVersion":"cancun","hardhatAccounts":{"count":40},"nodeVersion":"v22.22.2","optimizer":{"enabled":true,"runs":200},"pythonVersion":"Python 3.13.12","solidity":"0.8.26","viaIR":true},"chain":{"backend":"hardhat","chainId":31337,"finalityDefinition":"local-automining-no-consensus-finality","hardfork":"cancun","network":"hardhat-local","rpcMode":"in-process"},"configPath":"manifest/config.resolved.json","configSha256":"044f0feabdfea2f4cf47f8bd29931aee2724b7a17b223796c3617841f764befc","createdAtUtc":"2026-09-16T17:46:56.412Z","dependencySnapshotPath":"manifest/dependencies.json","environmentSnapshotPath":"manifest/environment_public.json","evidenceRoot":".","gitBranch":"main","gitDirty":true,"gitHead":"615bb3e9f1ae3b88b87f488decc61854cd555e16","limitations":["当前结果依赖工作区快照，不等同于仅由 HEAD commit 表示","链身份固定为 Hardhat chainId 31337、Cancun；本地自动出块无真实共识最终性","TEE 仅 simulated-only；DA 仅 local-mock-or-offline-only；Blob 仅 offline-only","不实现恢复协议、远程证明、真实 DA、真实 Blob 取回或罚没闭环","费用不得从本地 gas 推断成真实费用","公开哈希不按长度当作私钥；安全检查依赖敏感键、内容上下文及助记词形态，不读取 .env 或环境秘密值"],"metricDefinitions":{"blob":{"blobBytes":131072,"blobCount":"ceil(encodedBytes / 131072)","capacityRule":"实际编码器暂仅单 Blob；推导 blobCount > 1 时必须 blocked，不截断、不缩小载荷、不伪装多 Blob 编码已完成","encodedBytes":"ceil(frameBytes / 31) * 32","encoderMaxBlobs":1,"fieldDataBytes":31,"fieldEncodedBytes":32,"fieldPaddingBytes":"ceil(frameBytes / 31) * 31 - frameBytes；最后数据域补齐字节，另记，不含每域前置零字节","fieldPrefixBytes":"ceil(frameBytes / 31)；每个 32 字节域一个前置零字节，不计入 fieldPaddingBytes","frameBytes":"实际序列化帧长度，包含框架头部及任务元数据；必须来自编码器，不能直接用原始载荷冒充","paddingBytes":"blobCount * 131072 - encodedBytes；仅 Blob 尾部填充"},"cost":{"blobFee":"blobGasUsed * blobGasPrice","blobGasPrice":"实际每 Blob gas 价格","blobGasUsed":"实际 Blob gas 用量；离线字节数不能代替链上回执","challengeCost":"挑战阶段费用","costPerAcceptedTask":"totalMeasuredCost / acceptedTasks；次指标","costPerFinalizedTask":"totalMeasuredCost / finalizedTasks；主指标","costPerSubmittedBatch":"totalMeasuredCost / submittedBatches；次指标，当前每样本最多一个逻辑批次，重试不重复计数","daServiceCost":"DA 服务费用","denominatorRule":"finalizedTasks <= acceptedTasks <= taskCount，且与对应吞吐 numerator 一致；未测量分母 null，禁止用配置任务数代替实际分母","effectiveGasPrice":"每 gas 的实际价格；本地阶段 A 不测量，null","failedAttemptCost":"失败尝试费用子集，已包含在 totalMeasuredCost，不重复加总","feeSource":"local-gas-only","feeStatus":"not_measured","gasUsed":"l1ExecutionGas 的兼容别名；同时提供时必须相同","includeFailedAttempts":true,"l1ExecutionFee":"l1ExecutionGas * effectiveGasPrice","l1ExecutionGas":"L1 执行 gas 数量，不是货币费用；非负安全整数或 null","localHardLimit":"仅 gasUsed/l1ExecutionGas 和实际任务/批次分母可为数值；所有价格及货币费用字段必须 null，包括 Blob gas/fee；不得虚构真实网络费用","recoveryCost":"恢复阶段费用","settlementCost":"结算阶段费用","teeExecutionCost":"TEE 执行费用","teeVerificationCost":"TEE 证明验证费用","totalMeasuredCost":"同一窗口、同一货币单位下不重叠费用项之和，包含失败与重试；链上总费用与挑战/恢复/结算阶段归因不得重复求和","zeroDenominator":"所有单位费用在分母零或未测量时为 null，并逐项解释"},"limitations":["链身份固定为 Hardhat chainId 31337、Cancun；本地自动出块无真实共识最终性","TEE 仅 simulated-only；DA 仅 local-mock-or-offline-only；Blob 仅 offline-only","不实现恢复协议、远程证明、真实 DA、真实 Blob 取回或罚没闭环","费用不得从本地 gas 推断成真实费用","公开哈希不按长度当作私钥；安全检查依赖敏感键、内容上下文及助记词形态，不读取 .env 或环境秘密值"],"recording":{"durability":"写前校验并重新读取磁盘去重，独占锁防止协作进程并行追加；正常异常回滚长度；进程中断造成两文件不一致或遗留锁时拒绝续写，不宣称具备协议恢复能力","eventIdentity":"eventId 为 UUID v4；必须关联已写入样本，允许同一样本多个不同事件","evidence":"相对于 run 根目录的路径，拒绝绝对路径、点/上级目录、URL、反斜线与符号链接逃逸","failure":"fail/blocked 必须 failure.code 与 failure.message；skipped 必须 statusReason","failures":"raw/failures.jsonl 保存与失败样本完全相同的完整记录，通过三元身份关联","json":"UTF-8，所有对象键按字典序排序，末尾换行；JSONL 每行完整对象，文本内换行必须转义","nullReasons":"所有 workload/timeline/cost/throughput 的 null 字段用 notApplicableReason 完整路径逐项解释","sampleIdentity":["runId","experimentId","sampleId"],"status":["pass","fail","blocked","skipped"],"timestamps":"真实有效 UTC ISO 8601 毫秒 Z；结束不早于开始；durationMs 容差 1ms"},"recovery":{"failureDetectionTime":"failureDetectedAt - faultInjectedAt","firstProgressRecoveryTime":"firstValidProgressAt - faultInjectedAt","recoveryTakeoverTime":"recoveryTriggeredAt - failureDetectedAt","rule":"阶段 A 仅冻结起止定义；没有测量则 null 并解释，不输出无起止点的 recoveryTime，不以 recover 调用成功等同恢复完成","settlementRecoveryTime":"finalizedAt - faultInjectedAt","timeline":["faultInjectedAt","failureDetectedAt","recoveryTriggeredAt","firstValidProgressAt","resolvedAt","finalizedAt","withdrawableAt"],"unit":"milliseconds","withdrawalRecoveryTime":"withdrawableAt - faultInjectedAt"},"schemaVersion":"hybrid-tee-rollup.metrics.stageA.v1","scope":"阶段 A 本地、离线实验口径；不证明恢复、真实 TEE、真实 DA 或罚没闭环已实现","throughput":{"acceptedThroughput":{"denominator":"l1AcceptanceWindowSeconds","end":"L1 接受测量窗口结束时间","numerator":"acceptedTasks","start":"L1 接受测量窗口开始时间"},"executionThroughput":{"denominator":"executionWindowSeconds","end":"实际执行窗口结束时间","numerator":"executedTasks","start":"实际执行窗口开始时间"},"failure":"窗口内失败尝试次数，非负整数；未测量 null，不默认零","finalizedThroughput":{"denominator":"finalizationWindowSeconds","end":"最终确认测量窗口结束时间","numerator":"finalizedTasks","start":"最终确认测量窗口开始时间"},"formula":"value = numerator / denominator；denominator = (end - start) / 1000 秒","missingMeasurement":"未测量的全部七字段为 null，notApplicableReason 使用完整点分隔路径逐项解释","numeratorRule":"去重逻辑任务数，不含失败尝试和重复重试；每样本计数 <= taskCount","recordFields":["value","numerator","denominator","start","end","failure","retry"],"retry":"窗口内重试次数，非负整数；未测量 null，不默认零","throughputEnvironment":"local-hardhat-automining","warning":"本地自动出块和离线运行吞吐不等于公网 TPS，也不代表真实共识最终性","windowRule":"测量窗口必须完整且包含相应失败及重试耗时；不把单次成功耗时冒充整体窗口","zeroDenominator":"分母为零时 value = null 并逐项解释，禁止 Infinity/NaN"},"workload":{"actualInFlight":"实际观测的同时在途逻辑批次数；null 或正整数，不能超过 configuredConcurrency；低于目标必须解释","batchPayloadBytes":"batchSize * payloadBytesPerTask","batchSemantics":"既有脚本未实现链上聚合时必须标注 client-dispatch-group，不得宣称链上批处理","batchSize":"一个逻辑实验批次的任务数；每样本一个逻辑批次","concurrencyUnit":"inflight_batches","configuredConcurrency":"配置的同时在途逻辑批次数，正整数；不使用 Math.min(batchSize, concurrency)","dispatchGroupSize":"客户端调度组大小，与逻辑 batchSize 独立；未测量为 null","payloadBytesPerTask":"payloadKiBPerTask * 1024","payloadKiBPerTask":"每任务原始载荷，1 KiB = 1024 bytes","stepCount":"每任务执行步骤数；未测量为 null，不从任务数推断","taskCount":"taskCount = batchSize"}},"runId":"stageC-freeze-20260916T174457Z","schemaVersion":"hybrid-tee-rollup.stageA.v1","sourceFileSha256Path":"manifest/source_files.sha256","sourceTreeSha256":"ead8b96a915afa53ca94e3bb99208d6621b970be8d261033540c3ad6b227a298","status":"ready","trackedDiffSha256":"e3b0c44298fc1c149afbf4c8996fb92427ae41e4649b934ca495991b7852b855","untrackedFiles":["\"Hybrid_TEE_Rollup\\344\\277\\256\\346\\224\\271\\347\\211\\210.docx\"","\"\\346\\212\\225\\347\\250\\277\\346\\250\\241\\347\\211\\210.doc\"","\"outputs/.\\346\\212\\225\\347\\250\\277\\344\\277\\241\\346\\201\\257\\347\\231\\273\\350\\256\\260\\350\\241\\250.ref/build.py\"","\"outputs/Codex\\351\\230\\266\\346\\256\\265B-G\\346\\217\\220\\347\\244\\272\\350\\257\\215\\345\\214\\205_20260917.zip\"","\"outputs/Codex\\351\\230\\266\\346\\256\\265B-G\\346\\217\\220\\347\\244\\272\\350\\257\\215_20260917/00_\\346\\200\\273\\346\\216\\247\\344\\270\\216\\351\\230\\266\\346\\256\\265A\\344\\272\\244\\346\\216\\245.md\"","\"outputs/Codex\\351\\230\\266\\346\\256\\265B-G\\346\\217\\220\\347\\244\\272\\350\\257\\215_20260917/B_\\346\\234\\254\\345\\234\\260\\345\\212\\237\\350\\203\\275\\345\\256\\211\\345\\205\\250\\344\\270\\216\\350\\265\\204\\351\\207\\221\\351\\227\\255\\347\\216\\257.md\"","\"outputs/Codex\\351\\230\\266\\346\\256\\265B-G\\346\\217\\220\\347\\244\\272\\350\\257\\215_20260917/C_\\346\\201\\242\\345\\244\\215\\346\\264\\273\\346\\200\\247\\344\\270\\262\\350\\260\\213\\344\\270\\216DoS.md\"","\"outputs/Codex\\351\\230\\266\\346\\256\\265B-G\\346\\217\\220\\347\\244\\272\\350\\257\\215_20260917/D_\\347\\234\\237\\345\\256\\236TEE\\350\\257\\201\\346\\230\\216\\344\\270\\216\\345\\272\\224\\347\\224\\250\\346\\211\\247\\350\\241\\214.md\"","\"outputs/Codex\\351\\230\\266\\346\\256\\265B-G\\346\\217\\220\\347\\244\\272\\350\\257\\215_20260917/E_\\347\\234\\237\\345\\256\\236Blob\\347\\273\\221\\345\\256\\232\\344\\270\\216DA\\347\\273\\223\\347\\256\\227.md\"","\"outputs/Codex\\351\\230\\266\\346\\256\\265B-G\\346\\217\\220\\347\\244\\272\\350\\257\\215_20260917/F_\\346\\200\\247\\350\\203\\275\\350\\264\\271\\347\\224\\250\\347\\273\\237\\350\\256\\241\\344\\270\\216\\346\\266\\210\\350\\236\\215.md\"","\"outputs/Codex\\351\\230\\266\\346\\256\\265B-G\\346\\217\\220\\347\\244\\272\\350\\257\\215_20260917/G_\\347\\254\\254\\344\\270\\211\\346\\226\\271\\346\\234\\272\\345\\210\\266\\344\\270\\216\\345\\256\\232\\351\\207\\217\\346\\257\\224\\350\\276\\203.md\"","\"outputs/Hybrid_TEE_Rollup\\345\\256\\236\\351\\252\\214\\350\\241\\245\\345\\205\\205\\350\\257\\246\\347\\273\\206\\346\\265\\201\\347\\250\\213.docx\"","\"outputs/Hybrid_TEE_Rollup\\350\\256\\272\\346\\226\\207\\350\\277\\224\\344\\277\\256\\345\\256\\236\\346\\226\\275\\350\\256\\241\\345\\210\\222.docx\"","\"outputs/Hybrid_TEE_Rollup_\\350\\256\\241\\347\\256\\227\\346\\234\\272\\345\\272\\224\\347\\224\\250\\346\\212\\225\\347\\250\\277\\347\\211\\210.docx\"","\"outputs/\\344\\272\\244\\344\\273\\230\\350\\257\\264\\346\\230\\216_\\350\\256\\241\\347\\256\\227\\346\\234\\272\\345\\272\\224\\347\\224\\250\\346\\212\\225\\347\\250\\277\\347\\211\\210.md\"","\"outputs/\\345\\256\\236\\351\\252\\214\\350\\241\\245\\345\\205\\205\\346\\265\\201\\347\\250\\213.md\"","\"outputs/\\345\\256\\236\\351\\252\\214\\350\\241\\245\\345\\205\\205\\346\\265\\201\\347\\250\\213\\345\\206\\205\\345\\256\\271.json\"","\"outputs/\\346\\212\\225\\347\\250\\277\\343\\200\\212\\350\\256\\241\\347\\256\\227\\346\\234\\272\\345\\272\\224\\347\\224\\250\\343\\200\\213\\346\\250\\241\\346\\235\\277\\346\\224\\271\\351\\200\\240\\350\\256\\241\\345\\210\\222.md\"","\"outputs/\\346\\212\\225\\347\\250\\277\\344\\277\\241\\346\\201\\257\\347\\231\\273\\350\\256\\260\\350\\241\\250.xlsx\"","\"outputs/\\346\\217\\222\\345\\233\\276